{"small_version":"2.0.0","project_id":"project_a89af76cb6a8d3fb5d3e29ac22a0c35d","lineage_id":"lineage_1ae9a2104e6dbeaa037eef39d97d39d2","mode":"solo","policy_revision":"policy_6e0fa51f664cce0629cd586cac440476","intent_digest":"d9e54a6dd3955af584174a93bb08fa6abe1007b6e3802c063e14494e0b595a1c","constraints_digest":"c9089aef6703f2c4bf51e982a317e5e002b5fb260508fff072df86641fe8b3ac","import_id":"import_a89af76cb6a8d3fb5d3e29ac22a0c35d"}
